{
  "schema_version": "1.0.0",
  "payload_type": "cascade_data",
  "vertical": "real_estate",
  "cascades": {
    "re_q1": {
      "question_id": "re_q1",
      "reported_value": "See dashboard",
      "audited_value": "See audit report",
      "delta": "Under review",
      "root_cause": "Reported vacancy_loss for 2025-12 is 5.1%, but recomputed value from raw events is 0.0%. Discrepancy of +100.0%.",
      "consequence": "This finding affects data reliability. Investigate root cause of vacancy_loss discrepancy for 2025-12. Check for duplicate events, missing data, or filter logic differences.",
      "reviewer_badge": {
        "reviewer_name": "Data Quality Team",
        "status": "pending"
      },
      "timeline_steps": [
        {
          "step_type": "finding",
          "label": "vacancy_loss misreported for 2025-12 (off by +100.0%)",
          "description": "Reported vacancy_loss for 2025-12 is 5.1%, but recomputed value from raw events is 0.0%. Discrepancy of +100.0%."
        },
        {
          "step_type": "correction",
          "label": "Investigate root cause of vacancy_loss discrepancy for 2025-12. Check for duplicate events, missing data, or filter logic differences.",
          "description": "Correction steps identified"
        },
        {
          "step_type": "governance",
          "label": "Review pending_review",
          "description": "Awaiting governance review and sign-off"
        }
      ]
    },
    "re_q2": {
      "question_id": "re_q2",
      "reported_value": "See dashboard",
      "audited_value": "See audit report",
      "delta": "Under review",
      "root_cause": "60 near-duplicate rows detected (identical on all fields except key columns). This suggests duplicate ingestion or recording.",
      "consequence": "This finding affects data reliability. Investigate duplicate records. Add dedup logic keyed on non-key fields.",
      "reviewer_badge": {
        "reviewer_name": "Data Quality Team",
        "status": "pending"
      },
      "timeline_steps": [
        {
          "step_type": "finding",
          "label": "Near-duplicate rows detected",
          "description": "60 near-duplicate rows detected (identical on all fields except key columns). This suggests duplicate ingestion or recording."
        },
        {
          "step_type": "correction",
          "label": "Investigate duplicate records. Add dedup logic keyed on non-key fields.",
          "description": "Correction steps identified"
        },
        {
          "step_type": "governance",
          "label": "Review pending_review",
          "description": "Awaiting governance review and sign-off"
        }
      ]
    },
    "re_q3": {
      "question_id": "re_q3",
      "reported_value": "See dashboard",
      "audited_value": "See audit report",
      "delta": "Under review",
      "root_cause": "60 near-duplicate rows detected (identical on all fields except key columns). This suggests duplicate ingestion or recording.",
      "consequence": "This finding affects data reliability. Investigate duplicate records. Add dedup logic keyed on non-key fields.",
      "reviewer_badge": {
        "reviewer_name": "Data Quality Team",
        "status": "pending"
      },
      "timeline_steps": [
        {
          "step_type": "finding",
          "label": "Near-duplicate rows detected",
          "description": "60 near-duplicate rows detected (identical on all fields except key columns). This suggests duplicate ingestion or recording."
        },
        {
          "step_type": "correction",
          "label": "Investigate duplicate records. Add dedup logic keyed on non-key fields.",
          "description": "Correction steps identified"
        },
        {
          "step_type": "governance",
          "label": "Review pending_review",
          "description": "Awaiting governance review and sign-off"
        }
      ]
    },
    "re_q4": {
      "question_id": "re_q4",
      "reported_value": "See dashboard",
      "audited_value": "See audit report",
      "delta": "Under review",
      "root_cause": "Reported vacancy_loss for 2025-12 is 5.1%, but recomputed value from raw events is 0.0%. Discrepancy of +100.0%.",
      "consequence": "This finding affects data reliability. Investigate root cause of vacancy_loss discrepancy for 2025-12. Check for duplicate events, missing data, or filter logic differences.",
      "reviewer_badge": {
        "reviewer_name": "Data Quality Team",
        "status": "pending"
      },
      "timeline_steps": [
        {
          "step_type": "finding",
          "label": "vacancy_loss misreported for 2025-12 (off by +100.0%)",
          "description": "Reported vacancy_loss for 2025-12 is 5.1%, but recomputed value from raw events is 0.0%. Discrepancy of +100.0%."
        },
        {
          "step_type": "correction",
          "label": "Investigate root cause of vacancy_loss discrepancy for 2025-12. Check for duplicate events, missing data, or filter logic differences.",
          "description": "Correction steps identified"
        },
        {
          "step_type": "governance",
          "label": "Review pending_review",
          "description": "Awaiting governance review and sign-off"
        }
      ]
    },
    "re_q5": {
      "question_id": "re_q5",
      "reported_value": "See dashboard",
      "audited_value": "See audit report",
      "delta": "Under review",
      "root_cause": "Reported vacancy_loss for 2025-12 is 5.1%, but recomputed value from raw events is 0.0%. Discrepancy of +100.0%.",
      "consequence": "This finding affects data reliability. Investigate root cause of vacancy_loss discrepancy for 2025-12. Check for duplicate events, missing data, or filter logic differences.",
      "reviewer_badge": {
        "reviewer_name": "Data Quality Team",
        "status": "pending"
      },
      "timeline_steps": [
        {
          "step_type": "finding",
          "label": "vacancy_loss misreported for 2025-12 (off by +100.0%)",
          "description": "Reported vacancy_loss for 2025-12 is 5.1%, but recomputed value from raw events is 0.0%. Discrepancy of +100.0%."
        },
        {
          "step_type": "correction",
          "label": "Investigate root cause of vacancy_loss discrepancy for 2025-12. Check for duplicate events, missing data, or filter logic differences.",
          "description": "Correction steps identified"
        },
        {
          "step_type": "governance",
          "label": "Review pending_review",
          "description": "Awaiting governance review and sign-off"
        }
      ]
    }
  }
}
